REFERENCIA_ORDENADA,COD_ACERVO,SEMESTRE,PERIODO,ANO,VOLUME,TIPO_BIBLIOGRAFIA,COD_DISCIPLINA,DESC_DISCIPLINA,CODIGO_DEPARTAMENTO,SEQ_PROGRAMA,NOME_DEPARTAMENTO,COD_BIBLIOTECA,RESPONSAVEL,AQU_ITEM,VAGAS,QTDE_EMP,DESC_BIBLIOTECA,QTDE_EXE,VAGAS_EXE,CONCEITO
"GODOY, R. Topografia Básica.  Piracicaba: Fundação de Estudos Agrários Luiz Queirós, 1988. ",-4187,1,3,2013,,Complementar**,GEN092,Topografia,1301,1301201313,ENGENHARIA AMBIENTAL E SANITÁRIA - BACHARELADO,1,,,50,0,Biblioteca Chapecó,0,,
"JORDAN, N. Tratado General de Topografia.  5. Barcelona: Gustavo Gili, 1978. ",-4188,1,3,2013,,Complementar**,GEN092,Topografia,1301,1301201313,ENGENHARIA AMBIENTAL E SANITÁRIA - BACHARELADO,1,,,50,0,Biblioteca Chapecó,0,,
"LOCK, C.; CORONI, J. Topografia Contemporânea: Planimetria.  Florianópolis: UFSC, 1995. ",-4189,1,3,2013,,Complementar**,GEN092,Topografia,1301,1301201313,ENGENHARIA AMBIENTAL E SANITÁRIA - BACHARELADO,1,,,50,0,Biblioteca Chapecó,0,,
"SILVEIRA, L. C. da. Cálculos Geodésicos no Sistema UTM aplicados à Topografia.  2. Criciúma: Editora e Livraria Luana Ltda, 1993. ",-4190,1,3,2013,,Complementar**,GEN092,Topografia,1301,1301201313,ENGENHARIA AMBIENTAL E SANITÁRIA - BACHARELADO,1,,,50,0,Biblioteca Chapecó,0,,
"DUARTE, P. A. Fundamentos de Cartografia.  Mapas Editora & Consultoria, 2008. ",-4228,1,4,2013,,B¿sica**,GEX296,Cartografia,1301,1301201314,ENGENHARIA AMBIENTAL E SANITÁRIA - BACHARELADO,1,,,50,0,Biblioteca Chapecó,0,,
"RAMOS, C. S. Visualização cartográfica e cartografia multimídia: conceitos e tecnologias.  São Paulo: EDUNESP, 2005. ",-4232,1,4,2013,,B¿sica**,GEX296,Cartografia,1301,1301201314,ENGENHARIA AMBIENTAL E SANITÁRIA - BACHARELADO,1,,,50,0,Biblioteca Chapecó,0,,
"DENT, B. D. Cartography Thematic Map Design.  5. WCB/McGraw Hill, 1999. ",-4236,1,4,2013,,Complementar**,GEX296,Cartografia,1301,1301201314,ENGENHARIA AMBIENTAL E SANITÁRIA - BACHARELADO,1,,,50,0,Biblioteca Chapecó,0,,1
"GASPAR, J. A. Cartas e projeções cartográficas.  2. Lisboa: Lidel, 2002. ",-4238,1,4,2013,,Complementar**,GEX296,Cartografia,1301,1301201314,ENGENHARIA AMBIENTAL E SANITÁRIA - BACHARELADO,1,,,50,0,Biblioteca Chapecó,0,,1
"IBGE. Glossário cartográfico.  Rio de Janeiro ,  1999. ",-4239,1,4,2013,,Complementar**,GEX296,Cartografia,1301,1301201314,ENGENHARIA AMBIENTAL E SANITÁRIA - BACHARELADO,1,,,50,0,Biblioteca Chapecó,0,,1
"IBGE. Noções básicas de cartografia.  Rio de Janeiro ,  1999. ",-4240,1,4,2013,,Complementar**,GEX296,Cartografia,1301,1301201314,ENGENHARIA AMBIENTAL E SANITÁRIA - BACHARELADO,1,,,50,0,Biblioteca Chapecó,0,,1
"OLIVEIRA, C. Curso de cartografia moderna.  2. Rio de Janeiro: IBGE, 1993. ",-4241,1,4,2013,,Complementar**,GEX296,Cartografia,1301,1301201314,ENGENHARIA AMBIENTAL E SANITÁRIA - BACHARELADO,1,,,50,0,Biblioteca Chapecó,0,,1
"RAISZ, E. Cartografia geral.  Rio de Janeiro: Científica, 1969. ",-4242,1,4,2013,,Complementar**,GEX296,Cartografia,1301,1301201314,ENGENHARIA AMBIENTAL E SANITÁRIA - BACHARELADO,1,,,50,0,Biblioteca Chapecó,0,,1
"AXT, R.; GUIMARÃES, V. H. Física Experimental: manual de laboratório para mecânica e calor.  2. Porto Alegre: Editora da UFRGS, 1991. ",-4252,1,4,2013,,B¿sica**,GEX067,Física Experimental II,1301,1301201314,ENGENHARIA AMBIENTAL E SANITÁRIA - BACHARELADO,1,,,50,0,Biblioteca Chapecó,0,,
"FREEDMAN, R. A.; YOUNG, H. D. FÍSICA III: Eletromagnetismo.  12. São Paulo: Addison-Wesley, 2008. ",-4245,1,4,2013,3,B¿sica**,GEX219,Física III,1301,1301201314,ENGENHARIA AMBIENTAL E SANITÁRIA - BACHARELADO,1,,,50,0,Biblioteca Chapecó,0,,
"BENNET, C. O.; MYERS, J. E. Fenômenos de transporte.  : McGraw-Hill, 1978. ",-4255,1,4,2013,,B¿sica**,GEN097,Mecânica dos Fluídos,1301,1301201314,ENGENHARIA AMBIENTAL E SANITÁRIA - BACHARELADO,1,,,50,0,Biblioteca Chapecó,0,,
"HIMMELBLAU, D. M.; BRIGGS, J. L. Engenharia química: princípios e cálculos.  7. Rio de Janeiro: LTC, 2006. ",-4260,1,4,2013,,B¿sica**,GEN097,Mecânica dos Fluídos,1301,1301201314,ENGENHARIA AMBIENTAL E SANITÁRIA - BACHARELADO,1,,,50,0,Biblioteca Chapecó,0,,
"SHAMES, I. H. Mecânica dos Fluidos.  São Paulo: Edgard Blüncher, 1992. ",-4261,1,4,2013,,B¿sica**,GEN097,Mecânica dos Fluídos,1301,1301201314,ENGENHARIA AMBIENTAL E SANITÁRIA - BACHARELADO,1,,,50,0,Biblioteca Chapecó,0,,
"SISSON, L. E.; PITTS, D. R. Fenômenos de transporte.  Guanabara, 1988. ",-4259,1,4,2013,,B¿sica**,GEN097,Mecânica dos Fluídos,1301,1301201314,ENGENHARIA AMBIENTAL E SANITÁRIA - BACHARELADO,1,,,50,0,Biblioteca Chapecó,0,,
"BALDINO JR, A. C.; CRUZ, A. J. G. Fundamentos de balanços de massa e energia: um texto básico para análise de processos químicos.  EDUFSCAR, 2012. ",-4262,1,4,2013,,Complementar**,GEN097,Mecânica dos Fluídos,1301,1301201314,ENGENHARIA AMBIENTAL E SANITÁRIA - BACHARELADO,1,,,50,0,Biblioteca Chapecó,0,,1
"GOMIDE, R. Fluidos na Indústria.  1993. ",-4264,1,4,2013,,Complementar**,GEN097,Mecânica dos Fluídos,1301,1301201314,ENGENHARIA AMBIENTAL E SANITÁRIA - BACHARELADO,1,,,50,0,Biblioteca Chapecó,0,,1
"SCHULZ, H. E. O essencial em fenômenos de transporte.  Projeto REENGE EESC, 2003. ",-4265,1,4,2013,,Complementar**,GEN097,Mecânica dos Fluídos,1301,1301201314,ENGENHARIA AMBIENTAL E SANITÁRIA - BACHARELADO,1,,,50,0,Biblioteca Chapecó,0,,1
"GERE, J. M.; GOODNO, B. J. Mecânica dos Materiais.  São Paulo: Cengage Learning, 2010. ",-4214,1,4,2013,,Complementar**,GEN096,Mecânica e Resistência dos Materiais,1301,1301201314,ENGENHARIA AMBIENTAL E SANITÁRIA - BACHARELADO,1,,,50,0,Biblioteca Chapecó,0,,1
"SHAMES, I. H. Introdução à Mecânica dos Sólidos.  Rio de Janeiro: Prentice Hall do Brasil, 1983. ",-4215,1,4,2013,,Complementar**,GEN096,Mecânica e Resistência dos Materiais,1301,1301201314,ENGENHARIA AMBIENTAL E SANITÁRIA - BACHARELADO,1,,,50,0,Biblioteca Chapecó,0,,1
"TIMOSHENKO, S. P.; GERE, J. E. Mecânica dos sólidos.  Rio de Janeiro: LTC, 1993. ",-4217,1,4,2013,,Complementar**,GEN096,Mecânica e Resistência dos Materiais,1301,1301201314,ENGENHARIA AMBIENTAL E SANITÁRIA - BACHARELADO,1,,,50,0,Biblioteca Chapecó,0,,1
"TIMOSHENKO, S. P.; GOODIER, J. N. Teoria da Elasticidade.  Rio de Janeiro: Editora Guanabara Dois S.A., 1980. ",-4216,1,4,2013,,Complementar**,GEN096,Mecânica e Resistência dos Materiais,1301,1301201314,ENGENHARIA AMBIENTAL E SANITÁRIA - BACHARELADO,1,,,50,0,Biblioteca Chapecó,0,,1
"ATLAS, R. M.; BARTHA, R. Microbial ecology: fundamentals and applications.  4. Menlo Park: Benjamin Cummings Science Publishing, 1998. ",-4218,1,4,2013,,B¿sica**,GCB128,Microbiologia Ambiental,1301,1301201314,ENGENHARIA AMBIENTAL E SANITÁRIA - BACHARELADO,1,,,50,0,Biblioteca Chapecó,0,,
"MADSEN, E. L. Environmental Microbiology.  Oxford: Blackwell Publishing, 2008. ",-4220,1,4,2013,,Complementar**,GCB128,Microbiologia Ambiental,1301,1301201314,ENGENHARIA AMBIENTAL E SANITÁRIA - BACHARELADO,1,,,50,0,Biblioteca Chapecó,0,,1
"MELO, I. S.; AZEVEDO, J. L. Ecologia microbiana.  Jaguariúna: EMBRAPA/CNPMA, 1998. ",-4222,1,4,2013,,Complementar**,GCB128,Microbiologia Ambiental,1301,1301201314,ENGENHARIA AMBIENTAL E SANITÁRIA - BACHARELADO,1,,,50,0,Biblioteca Chapecó,0,,1
"PAUL, E. A. Soil microbiology, ecology, and biochemistry.  3. Oxford: Academic Press, 2007. ",-4224,1,4,2013,,Complementar**,GCB128,Microbiologia Ambiental,1301,1301201314,ENGENHARIA AMBIENTAL E SANITÁRIA - BACHARELADO,1,,,50,0,Biblioteca Chapecó,0,,1
"PRESCOTT, L. M.; HARLEY, J. P.; KLEIN, D. A. Microbiology.  5. Boston: McGraw Hil, 2002. ",-4225,1,4,2013,,Complementar**,GCB128,Microbiologia Ambiental,1301,1301201314,ENGENHARIA AMBIENTAL E SANITÁRIA - BACHARELADO,1,,,50,0,Biblioteca Chapecó,0,,1
"TALARO, K. P.; TALARO, A. Foundations in Microbiology.  4. Boston: McGraw Hil, 2002. ",-4226,1,4,2013,,Complementar**,GCB128,Microbiologia Ambiental,1301,1301201314,ENGENHARIA AMBIENTAL E SANITÁRIA - BACHARELADO,1,,,50,0,Biblioteca Chapecó,0,,1
"SONNTAG, R. E. Introdução a Termodinâmica para Engenharia.  1. Rio de Janeiro: LTC, 2003. ",-4267,1,4,2013,,B¿sica**,GEN098,Termodinâmica,1301,1301201314,ENGENHARIA AMBIENTAL E SANITÁRIA - BACHARELADO,1,,,50,0,Biblioteca Chapecó,0,,
"MORAN, M. J.; SHAPIRO, H. N. Princípios de Termodinâmica para Engenharia.  6. Rio de Janeiro: LTC, 2009. ",-4268,1,4,2013,,Complementar**,GEN098,Termodinâmica,1301,1301201314,ENGENHARIA AMBIENTAL E SANITÁRIA - BACHARELADO,1,,,50,0,Biblioteca Chapecó,0,,1
"EDWARDS JR., C. H.; PENNEY, D. E. Equações Diferenciais Elementares Com Problemas de Contorno.  3. Rio de Janeiro: Prentice Hall, 1995. ",-4316,1,5,2013,,B¿sica**,GEX462,Cálculo IV,1301,1301201315,ENGENHARIA AMBIENTAL E SANITÁRIA - BACHARELADO,1,,,50,0,Biblioteca Chapecó,0,,
"BASSANEZI, R.; FERREIRA JUNIOR, W. C. Equações diferenciais com aplicações.  Rio de Janeiro: Harbra, 1988. ",-4317,1,5,2013,,Complementar**,GEX462,Cálculo IV,1301,1301201315,ENGENHARIA AMBIENTAL E SANITÁRIA - BACHARELADO,1,,,50,0,Biblioteca Chapecó,0,,1
"FORBELLONE, A. L. V.; EBERSPÄCHER, H. F. Lógica de programação.  Editora Makron Books, 1993. ",-4318,1,5,2013,,B¿sica**,GEX209,Computação Básica,1301,1301201315,ENGENHARIA AMBIENTAL E SANITÁRIA - BACHARELADO,1,,,50,0,Biblioteca Chapecó,0,,
"TREMBLAY, J. P.; BUNT, R. B. Ciência dos computadores: uma abordagem Algorítmica.  São Paulo: McGraw Hil, 1989. ",-4319,1,5,2013,,B¿sica**,GEX209,Computação Básica,1301,1301201315,ENGENHARIA AMBIENTAL E SANITÁRIA - BACHARELADO,1,,,50,0,Biblioteca Chapecó,0,,
"GILAT, Amos. Matlab com aplicações em engenharia.  Artmed, 2006. ",-4320,1,5,2013,,Complementar**,GEX209,Computação Básica,1301,1301201315,ENGENHARIA AMBIENTAL E SANITÁRIA - BACHARELADO,1,,,50,0,Biblioteca Chapecó,0,,1
"HOLLOWAY, James P. Introdução à programação para engenharia.  LTC, 2005. ",-4321,1,5,2013,,Complementar**,GEX209,Computação Básica,1301,1301201315,ENGENHARIA AMBIENTAL E SANITÁRIA - BACHARELADO,1,,,50,0,Biblioteca Chapecó,0,,1
"LEITE, Mário. Scilab ¿ Uma abordagem Prática e Didática.  Ciência Moderna, 2009. ",-4322,1,5,2013,,Complementar**,GEX209,Computação Básica,1301,1301201315,ENGENHARIA AMBIENTAL E SANITÁRIA - BACHARELADO,1,,,50,0,Biblioteca Chapecó,0,,1
"MANZANO, José Augusto N. G.; OLIVEIRA, Jayr Figueiredo de. Estudo Dirigido de Algoritmos.  São Paulo: Editora Érica, 2004. ",-4323,1,5,2013,,Complementar**,GEX209,Computação Básica,1301,1301201315,ENGENHARIA AMBIENTAL E SANITÁRIA - BACHARELADO,1,,,50,0,Biblioteca Chapecó,0,,1
"CREDER, H. Instalações Elétricas.  15. Rio de Janeiro: LTC, 2007. ",-4333,1,5,2013,,B¿sica**,GEN099,Eletrotécnica,1301,1301201315,ENGENHARIA AMBIENTAL E SANITÁRIA - BACHARELADO,1,,,50,0,Biblioteca Chapecó,0,,
"CRUZ, E. C. A.; ANICETO, L. A. Instalações Elétricas: fundamentos, práticas e projetos de instalações residenciais e comerciais.  1. São Paulo: Érica, 2011. ",-4334,1,5,2013,,B¿sica**,GEN099,Eletrotécnica,1301,1301201315,ENGENHARIA AMBIENTAL E SANITÁRIA - BACHARELADO,1,,,50,0,Biblioteca Chapecó,0,,
"FILHO, J. M. Instalações Elétricas Industriais.  Rio de Janeiro: LTC, 2010. ",-4335,1,5,2013,,B¿sica**,GEN099,Eletrotécnica,1301,1301201315,ENGENHARIA AMBIENTAL E SANITÁRIA - BACHARELADO,1,,,50,0,Biblioteca Chapecó,0,,
"NERY, N. Instalações Elétricas: princípios e aplicações.  2. São Paulo: Érica, 2012. ",-4336,1,5,2013,,B¿sica**,GEN099,Eletrotécnica,1301,1301201315,ENGENHARIA AMBIENTAL E SANITÁRIA - BACHARELADO,1,,,50,0,Biblioteca Chapecó,0,,
"FILHO, D. L. L. Projetos de instalações elétricas prediais.  12. São Paulo: Érica, 2011. ",-4338,1,5,2013,,Complementar**,GEN099,Eletrotécnica,1301,1301201315,ENGENHARIA AMBIENTAL E SANITÁRIA - BACHARELADO,1,,,50,0,Biblioteca Chapecó,0,,1
"NEGRISOLI, M. E. M. Instalações elétricas: projetos prediais.  3. São Paulo: Edgard Blüncher, 1987. ",-4340,1,5,2013,,Complementar**,GEN099,Eletrotécnica,1301,1301201315,ENGENHARIA AMBIENTAL E SANITÁRIA - BACHARELADO,1,,,50,0,Biblioteca Chapecó,0,,1
"NISKIER, J. Manual de instalações elétricas.  1. Rio de Janeiro: LTC, 2005. ",-4341,1,5,2013,,Complementar**,GEN099,Eletrotécnica,1301,1301201315,ENGENHARIA AMBIENTAL E SANITÁRIA - BACHARELADO,1,,,50,0,Biblioteca Chapecó,0,,1
"OLIVEIRA, A. M. S.; BRITO, S. N. A. Geologia de Engenharia.  São Paulo: ABGE, 1998. ",-4344,1,5,2013,,B¿sica**,GEN100,Geologia de Engenharia,1301,1301201315,ENGENHARIA AMBIENTAL E SANITÁRIA - BACHARELADO,1,,,50,0,Biblioteca Chapecó,0,,
"SANTOS, A. R. Geologia de Engenharia: Conceitos, Método e Prática.  2. São Paulo: O Nome da Rosa, 2009. ",-4346,1,5,2013,,B¿sica**,GEN100,Geologia de Engenharia,1301,1301201315,ENGENHARIA AMBIENTAL E SANITÁRIA - BACHARELADO,1,,,50,0,Biblioteca Chapecó,0,,
"LEINZ, V.; AMARAL, S. S. Geologia geral.  9. Rio de Janeiro: Nacional, 1985. ",-4349,1,5,2013,,Complementar**,GEN100,Geologia de Engenharia,1301,1301201315,ENGENHARIA AMBIENTAL E SANITÁRIA - BACHARELADO,1,,,50,0,Biblioteca Chapecó,0,,
"SCHUMANN, W. Guia dos Minerais: características, ocorrência, utilização.  Editora Disal, 2009. ",-4352,1,5,2013,,Complementar**,GEN100,Geologia de Engenharia,1301,1301201315,ENGENHARIA AMBIENTAL E SANITÁRIA - BACHARELADO,1,,,50,0,Biblioteca Chapecó,0,,
"CIRILO, J. A. Hidráulica aplicada.  2. Porto Alegre: ABRH, 2003. ",-4381,1,5,2013,,B¿sica**,GEN102,Hidráulica I,1301,1301201315,ENGENHARIA AMBIENTAL E SANITÁRIA - BACHARELADO,1,,,50,0,Biblioteca Chapecó,0,,
"GOMES, H. P. Sistemas de Abastecimento de Água: dimensionamento econômico e operação de redes e elevatórias.  2. João Pessoa: Editora Universitária/UFPB, 2004. ",-4382,1,5,2013,,B¿sica**,GEN102,Hidráulica I,1301,1301201315,ENGENHARIA AMBIENTAL E SANITÁRIA - BACHARELADO,1,,,50,0,Biblioteca Chapecó,0,,
"SANTOS, S. L. Bombas e Instalações Hidráulicas.  São Paulo: LCTE, 2007. ",-4383,1,5,2013,,B¿sica**,GEN102,Hidráulica I,1301,1301201315,ENGENHARIA AMBIENTAL E SANITÁRIA - BACHARELADO,1,,,50,0,Biblioteca Chapecó,0,,
"TOMAZ, P. Golpe de Ariete em Casas de Bombas.  São Paulo: Editora Navegar, 2004. ",-4384,1,5,2013,,B¿sica**,GEN102,Hidráulica I,1301,1301201315,ENGENHARIA AMBIENTAL E SANITÁRIA - BACHARELADO,1,,,50,0,Biblioteca Chapecó,0,,
"CRESPO, P. G. A. Elevatórias nos Sistemas de Esgoto.  Belo Horizonte: Editora UFMG, 2001. ",-4386,1,5,2013,,Complementar**,GEN102,Hidráulica I,1301,1301201315,ENGENHARIA AMBIENTAL E SANITÁRIA - BACHARELADO,1,,,50,0,Biblioteca Chapecó,0,,1
"TOMAZ, P. Rede de Água.  São Paulo: Navegar, 2011. ",-4387,1,5,2013,,Complementar**,GEN102,Hidráulica I,1301,1301201315,ENGENHARIA AMBIENTAL E SANITÁRIA - BACHARELADO,1,,,50,0,Biblioteca Chapecó,0,,1
"VIANNA, M. R. Mecânica dos Fluidos para Engenheiros.  3. Belo Horizonte: Imprimatur, 1997. ",-4388,1,5,2013,,Complementar**,GEN102,Hidráulica I,1301,1301201315,ENGENHARIA AMBIENTAL E SANITÁRIA - BACHARELADO,1,,,50,0,Biblioteca Chapecó,0,,1
"D¿ACAMPORA, A. J. Investigação científica.  Blumenau: Nova Letra, 2006. ",-4324,1,5,2013,,Complementar**,GCH310,Metodologia da Pesquisa,1301,1301201315,ENGENHARIA AMBIENTAL E SANITÁRIA - BACHARELADO,1,,,50,0,Biblioteca Chapecó,0,,
"GALLIANO, A. G. O. Método Científico: teoria e prática.  São Paulo: Harbra, 1986. ",-4325,1,5,2013,,Complementar**,GCH310,Metodologia da Pesquisa,1301,1301201315,ENGENHARIA AMBIENTAL E SANITÁRIA - BACHARELADO,1,,,50,0,Biblioteca Chapecó,0,,
"DRUCK, S.; CARVALHO, M. S.; CÂMARA, G.; MONTEIRO, A. V. M. Análise Espacial de Dados Geográficos.  Brasília: EMBRAPA, 2004. ",-4326,1,5,2013,,B¿sica**,GCH309,Sistema de Informações Geográficas,1301,1301201315,ENGENHARIA AMBIENTAL E SANITÁRIA - BACHARELADO,1,,,50,0,Biblioteca Chapecó,0,,
"MONICO, J. F. G. Posicionamento pelo NAVSTAR-GPS: Descrição, Fundamentos e Aplicações.  São Paulo: UNESP, 2000. ",-4327,1,5,2013,,B¿sica**,GCH309,Sistema de Informações Geográficas,1301,1301201315,ENGENHARIA AMBIENTAL E SANITÁRIA - BACHARELADO,1,,,50,0,Biblioteca Chapecó,0,,
"ANDERSON, P. S. Fundamentos para Fotointerpretação.  Rio de Janeiro: Sociedade Brasileira de Cartografia, 1982. ",-4328,1,5,2013,,Complementar**,GCH309,Sistema de Informações Geográficas,1301,1301201315,ENGENHARIA AMBIENTAL E SANITÁRIA - BACHARELADO,1,,,50,0,Biblioteca Chapecó,0,,1
"ASSAD, E. D.; SANO, E. E. Sistema de Informações Geográficas: Aplicações na Agricultura.  2. Brasília: EMBRAPA, 1998. ",-4329,1,5,2013,,Complementar**,GCH309,Sistema de Informações Geográficas,1301,1301201315,ENGENHARIA AMBIENTAL E SANITÁRIA - BACHARELADO,1,,,50,0,Biblioteca Chapecó,0,,1
"BURROUGH, P. A. Principles of Geographical Information Systems: Spatial Information Systems and Geoestatistics.  Oxford: Clarendon Press, 1998. ",-4330,1,5,2013,,Complementar**,GCH309,Sistema de Informações Geográficas,1301,1301201315,ENGENHARIA AMBIENTAL E SANITÁRIA - BACHARELADO,1,,,50,0,Biblioteca Chapecó,0,,1
"FLORENZANO, T. G. Imagens de Satélite para Estudos Ambientais.  São Paulo: Oficina de Textos, 2002. ",-4331,1,5,2013,,Complementar**,GCH309,Sistema de Informações Geográficas,1301,1301201315,ENGENHARIA AMBIENTAL E SANITÁRIA - BACHARELADO,1,,,50,0,Biblioteca Chapecó,0,,1
"ROSA, R. Introdução ao Sensoriamento Remoto.  EDUFUC, 1990. ",-4332,1,5,2013,,Complementar**,GCH309,Sistema de Informações Geográficas,1301,1301201315,ENGENHARIA AMBIENTAL E SANITÁRIA - BACHARELADO,1,,,50,0,Biblioteca Chapecó,0,,1
"BEJAN, Adrian. Transferência de Calor.  São Paulo: Edgard Blüncher, 1996. ",-4355,1,5,2013,,B¿sica**,GEN101,Transferência de Calor e Massa,1301,1301201315,ENGENHARIA AMBIENTAL E SANITÁRIA - BACHARELADO,1,,,50,0,Biblioteca Chapecó,0,,
"CUSSLER, E. L. Diffusion - Mass Transfer in Fluid System.  Cambridge: Cambridge University Press, 1984. ",-4356,1,5,2013,,B¿sica**,GEN101,Transferência de Calor e Massa,1301,1301201315,ENGENHARIA AMBIENTAL E SANITÁRIA - BACHARELADO,1,,,50,0,Biblioteca Chapecó,0,,
"KERN, Donald Q. Processos de Transmissão de Calor.  Rio de Janeiro: Guanabara Dois, 1980. ",-4359,1,5,2013,,B¿sica**,GEN101,Transferência de Calor e Massa,1301,1301201315,ENGENHARIA AMBIENTAL E SANITÁRIA - BACHARELADO,1,,,50,0,Biblioteca Chapecó,0,,
"MCCABE, W.; SMITH, J. C.; HARRIOT, P. Unit Operations of Chemical Engineering.  5. McGraw Hill International Editions, 1993. ",-4361,1,5,2013,,B¿sica**,GEN101,Transferência de Calor e Massa,1301,1301201315,ENGENHARIA AMBIENTAL E SANITÁRIA - BACHARELADO,1,,,50,0,Biblioteca Chapecó,0,,
"BIRD, R. B.; STEWART, W. E.; LIGTHFOOT, E. N. Transport Phenomena.  Wiley, 1960. ",-4362,1,5,2013,,Complementar**,GEN101,Transferência de Calor e Massa,1301,1301201315,ENGENHARIA AMBIENTAL E SANITÁRIA - BACHARELADO,1,,,50,0,Biblioteca Chapecó,0,,1
"GEANKOPLIS, C. Transport Phenomena and Unit Operations.  : McGraw Hil, 1993. ",-4365,1,5,2013,,Complementar**,GEN101,Transferência de Calor e Massa,1301,1301201315,ENGENHARIA AMBIENTAL E SANITÁRIA - BACHARELADO,1,,,50,0,Biblioteca Chapecó,0,,1
"HOLMAN, J. P. Transferência de calor.  : McGraw Hil, 1983. ",-4367,1,5,2013,,Complementar**,GEN101,Transferência de Calor e Massa,1301,1301201315,ENGENHARIA AMBIENTAL E SANITÁRIA - BACHARELADO,1,,,50,0,Biblioteca Chapecó,0,,1
"TREYBAL, R. Mass Transfer Operations.  3. McGraw Hil, 1980. ",-4369,1,5,2013,,Complementar**,GEN101,Transferência de Calor e Massa,1301,1301201315,ENGENHARIA AMBIENTAL E SANITÁRIA - BACHARELADO,1,,,50,0,Biblioteca Chapecó,0,,1
"HUMES, A. F. P. C. Noções de cálculo numérico.  São Paulo: McGraw Hil, 1984. ",-4406,1,6,2013,,B¿sica**,GEX395,Cálculo Numérico,1301,1301201316,ENGENHARIA AMBIENTAL E SANITÁRIA - BACHARELADO,1,,,50,0,Biblioteca Chapecó,0,,
"CLÁUDIO, D. M.; MARINS, J. M. Cálculo numérico computacional ¿ teoria e prática.  São Paulo: Atlas, 1989. ",-4408,1,6,2013,,Complementar**,GEX395,Cálculo Numérico,1301,1301201316,ENGENHARIA AMBIENTAL E SANITÁRIA - BACHARELADO,1,,,50,0,Biblioteca Chapecó,0,,
"ROQUE, W. L. Introdução ao cálculo numérico.  São Paulo: Atlas, 2000. ",-4411,1,6,2013,,Complementar**,GEX395,Cálculo Numérico,1301,1301201316,ENGENHARIA AMBIENTAL E SANITÁRIA - BACHARELADO,1,,,50,0,Biblioteca Chapecó,0,,
"FOGLER, H. S. Elementos de engenharia das reações químicas.  4. Rio de Janeiro: LTC, 2009. ",-4460,1,6,2013,,B¿sica**,GEX298,Cinética Aplicada e Cálculo de Reatores,1301,1301201316,ENGENHARIA AMBIENTAL E SANITÁRIA - BACHARELADO,1,,,50,0,Biblioteca Chapecó,0,,
"PINTO, G. F.; MENEZES, R. R. Cinética enzimática.  1. Rio de Janeiro: E-papers, 2009. ",-4462,1,6,2013,,B¿sica**,GEX298,Cinética Aplicada e Cálculo de Reatores,1301,1301201316,ENGENHARIA AMBIENTAL E SANITÁRIA - BACHARELADO,1,,,50,0,Biblioteca Chapecó,0,,
"SCHMAL, M. Cinética e reatores: aplicação na engenharia.  1. Rio de Janeiro: Synergia, 2010. ",-4463,1,6,2013,,B¿sica**,GEX298,Cinética Aplicada e Cálculo de Reatores,1301,1301201316,ENGENHARIA AMBIENTAL E SANITÁRIA - BACHARELADO,1,,,50,0,Biblioteca Chapecó,0,,
"AIBA, S.; HUMFHREY, A.; MILLIS, N. Biochemical Engineering.  Tokyo: University of Tokyo Press, 1979. ",-4465,1,6,2013,,Complementar**,GEX298,Cinética Aplicada e Cálculo de Reatores,1301,1301201316,ENGENHARIA AMBIENTAL E SANITÁRIA - BACHARELADO,1,,,50,0,Biblioteca Chapecó,0,,1
"BORZANI, W.; SCHMIDELL, W.; LIMA, U. A.; AQUARONE, E. Biotecnologia Industrial, Fundamentos.  São Paulo: Edgard Blüncher, 2001. ",-4468,1,6,2013,,Complementar**,GEX298,Cinética Aplicada e Cálculo de Reatores,1301,1301201316,ENGENHARIA AMBIENTAL E SANITÁRIA - BACHARELADO,1,,,50,0,Biblioteca Chapecó,0,,1
"FROMENT, G. F.; BISCHOFF, K. B. Chemical Reactor Analysis and Design.  2. New York: John Wiley & Sons, 1990. ",-4470,1,6,2013,,Complementar**,GEX298,Cinética Aplicada e Cálculo de Reatores,1301,1301201316,ENGENHARIA AMBIENTAL E SANITÁRIA - BACHARELADO,1,,,50,0,Biblioteca Chapecó,0,,1
"BOLDEA, I. The Electric Generators Handbook.  1. CRC Press, 2005. ",-4447,1,6,2013,,Complementar**,GEN011,Circuitos Elétricos e Conversão Eletromecânica de Energia,1301,1301201316,ENGENHARIA AMBIENTAL E SANITÁRIA - BACHARELADO,1,,,50,0,Biblioteca Chapecó,0,,
"BOYLESTAD, R. L. Introdução a Análise de Circuitos.  12. Pearson, 2012. ",-4449,1,6,2013,,Complementar**,GEN011,Circuitos Elétricos e Conversão Eletromecânica de Energia,1301,1301201316,ENGENHARIA AMBIENTAL E SANITÁRIA - BACHARELADO,1,,,50,0,Biblioteca Chapecó,0,,
"DESOER, C. A.; KUH, E. S. Teoria básica de circuitos lineares.  Editora Guanabara Dois, 1979. ",-4451,1,6,2013,,Complementar**,GEN011,Circuitos Elétricos e Conversão Eletromecânica de Energia,1301,1301201316,ENGENHARIA AMBIENTAL E SANITÁRIA - BACHARELADO,1,,,50,0,Biblioteca Chapecó,0,,
"CIRILO, J. A. Hidráulica aplicada.  2. Porto Alegre: ABRH, 2003. ",-4473,1,6,2013,,B¿sica**,GEN104,Hidráulica II,1301,1301201316,ENGENHARIA AMBIENTAL E SANITÁRIA - BACHARELADO,1,,,50,0,Biblioteca Chapecó,0,,
"CRESPO, P. G. A. Hidráulica e a Pneumática aplicadas às Estações de Tratamento de Esgotos.  Belo Horizonte: Editora UFMG, 2004. ",-4475,1,6,2013,,B¿sica**,GEN104,Hidráulica II,1301,1301201316,ENGENHARIA AMBIENTAL E SANITÁRIA - BACHARELADO,1,,,50,0,Biblioteca Chapecó,0,,
"LINSLEY, R. K.; FRANZINI, J. B. Engenharia de Recursos Hídricos.  São Paulo: McGraw Hil, 1978. ",-4476,1,6,2013,,B¿sica**,GEN104,Hidráulica II,1301,1301201316,ENGENHARIA AMBIENTAL E SANITÁRIA - BACHARELADO,1,,,50,0,Biblioteca Chapecó,0,,
"PIMENTA, C. F. Curso de Hidráulica Geral.  Rio de Janeiro: LTC, 1981. ",-4478,1,6,2013,1-2,B¿sica**,GEN104,Hidráulica II,1301,1301201316,ENGENHARIA AMBIENTAL E SANITÁRIA - BACHARELADO,1,,,50,0,Biblioteca Chapecó,0,,
"HWANG, N. H. Fundamentos de Sistemas de Engenharia Hidráulica.  1984. ",-4479,1,6,2013,,Complementar**,GEN104,Hidráulica II,1301,1301201316,ENGENHARIA AMBIENTAL E SANITÁRIA - BACHARELADO,1,,,50,0,Biblioteca Chapecó,0,,1
"TSUTIYA, M. T.; SOBRINHO, P. A. Coleta e Transporte de Esgoto Sanitário.  2. São Paulo: Departamento de Engenharia Hidráulica e Sanitária da Escola Politécnica da Universidade de São Paulo, 2000. ",-4480,1,6,2013,,Complementar**,GEN104,Hidráulica II,1301,1301201316,ENGENHARIA AMBIENTAL E SANITÁRIA - BACHARELADO,1,,,50,0,Biblioteca Chapecó,0,,1
"VIANNA, M. R. Hidráulica Aplicada a Estações de Tratamento de Água.  3. Belo Horizonte: Imprimatur, 1997. ",-4481,1,6,2013,,Complementar**,GEN104,Hidráulica II,1301,1301201316,ENGENHARIA AMBIENTAL E SANITÁRIA - BACHARELADO,1,,,50,0,Biblioteca Chapecó,0,,1
"TUCCI, C. E. M. Regionalização de vazões.  Porto Alegre: Editora Universidade/UFRGS, 2002. ",-4419,1,6,2013,,Complementar**,GEN042,Hidrologia,1301,1301201316,ENGENHARIA AMBIENTAL E SANITÁRIA - BACHARELADO,1,,,50,0,Biblioteca Chapecó,0,,1
"VILLELA, S. M.; MATTOS, A. Hidrologia aplicada.  São Paulo: McGraw Hil, 1975. ",-4421,1,6,2013,,Complementar**,GEN042,Hidrologia,1301,1301201316,ENGENHARIA AMBIENTAL E SANITÁRIA - BACHARELADO,1,,,50,0,Biblioteca Chapecó,0,,1
"CRAIG, R. F. Mecânica dos Solos.  7. Rio de Janeiro: LTC, 2007. ",-4453,1,6,2013,,B¿sica**,GCA322,Mecânica dos Solos,1301,1301201316,ENGENHARIA AMBIENTAL E SANITÁRIA - BACHARELADO,1,,,50,0,Biblioteca Chapecó,0,,
"NOGUEIRA, J. B. Mecânica dos solos.  São Carlos: EESC/USP, 1988. ",-4454,1,6,2013,,Complementar**,GCA322,Mecânica dos Solos,1301,1301201316,ENGENHARIA AMBIENTAL E SANITÁRIA - BACHARELADO,1,,,50,0,Biblioteca Chapecó,0,,
"ORTIGÃO, J. A. R. Introdução à mecânica dos solos dos estados críticos.  Rio de Janeiro: LTC, 1995. ",-4455,1,6,2013,,Complementar**,GCA322,Mecânica dos Solos,1301,1301201316,ENGENHARIA AMBIENTAL E SANITÁRIA - BACHARELADO,1,,,50,0,Biblioteca Chapecó,0,,
"QUEIROZ DE CARVALHO, J. B. Fundamentos da mecânica dos solos.  Marconi, 1997. ",-4456,1,6,2013,,Complementar**,GCA322,Mecânica dos Solos,1301,1301201316,ENGENHARIA AMBIENTAL E SANITÁRIA - BACHARELADO,1,,,50,0,Biblioteca Chapecó,0,,
